{"current_contract":{"artifact_id":"rcid:v1:trust-policy-revision:h:jcs-sha256-v1:9c38dd4a3817492504dd2027cf31efcbae150577b2cb57c76cf9afc69d4c524c","digest_sha256":"3cdfdc08971a31e725434b0184b0644d6ac56f806b9f6cbc630241cbcdacd017","file_sha256":"f237778a95ea28810d61c9a6cafed6d0112a271354d0d1dcae8a0213e4319a0e","path":"oracle/contracts/regex-conformance-oracles-2026-09-10.v1.json"},"derivation":{"derivation_class":"manual-decision","derivation_id":"rcid:v1:assertion-derivation:u7:01a08d07-ef56-7cf6-a0ec-bba01aa82e7c","derivation_revision_id":"rcid:v1:assertion-derivation-revision:h:jcs-sha256-v1:b2dd4986822cf4a84dc22e99f8379d1f970b0f5dcba346ce2ffe7617a50a1bdd"},"foundation_report":{"artifact_id":"rcid:v1:trust-assessment:h:jcs-sha256-v1:a20224633df1317117c4680212f59042184f2eae04fcc0e440603c0541b15407","digest_sha256":"5e10506f4dc41624aa4985da096f630f63dd19c43995778a5c8d8adb47cc33b8","file_sha256":"cbabe6d00c566a62c0c0a6c25a78fd43aaeccee2079d9db452f69939e67e073b","path":"reports/oracle/oracle-foundation-2026-09-10.v1.json"},"governance":"Repository oracle records and frozen bindings own machine-operational expectation authority; sources remain authoritative for their own propositions, observations remain empirical, and later adjudication must preserve conflicts.","historical_compatibility":{"existing_campaigns_reinterpreted":false,"existing_observations_rewritten":false,"migration_rule":"prospective-versioned-no-rewrite","mutable_latest_alias_is_certified_input":false},"index_digest_sha256":"cece933c250c5ddc8111f3cb00960fba4a3877b41e9d29b03b0e84946167c77d","index_id":"rcid:v1:artifact-set-manifest:h:jcs-sha256-v1:124d8dfb311c415c3451cfe0c4a845fe3f4a74875f04f8879f7e3df3cd8808f8","next_interfaces":{"applicability":"deferred","claims_and_adjudication":"deferred","production_vectors":"deferred","waivers":"deferred"},"schema_version":"oracle-authority-index.v1","semantic_requirement_authority":{"artifact_id":"rcid:v1:ontology-snapshot:h:jcs-sha256-v1:0d1e0a5375bad7d176ccf910097a23cb6cd2bd8cebd3c03faade67d5250a09af","digest_sha256":"a24769212046168016e839ac3ac8da92280b4022377f48c85ebcd40533a806fa","file_sha256":"6c7bb486760fa9cce52a6692a61aff074407899577573029b24e37cd34ecf9ec","path":"vectors/requirements/regex-semantic-vector-requirements-2026-09-08.v2.json"},"validation_fixture":{"artifact_id":"rcid:v1:expectation-projection:h:jcs-sha256-v1:6ec6b242f8d2a19ac2bc29968406bf69b8e8aa00c53f8e1a616149836a8b39ae","digest_sha256":"399283eb4ce73a35be46a0ea41b6463bc8d18dd8db8e52894b50e77d7ce957cf","file_sha256":"f81ff2c65d58fbcdd11b17414136bf304e2c28402abb3cca7e89fcab3b7227db","path":"tests/fixtures/oracle/oracle-validation-cases.v1.json"}}
